bad	收发联通为用户提供网上移动联通网通小灵通短信服务惊喜夏日大优惠可能通过不要发短信钱详情登陆清查询最新公告软件网址下载
bad	客人商务客户体贴休闲与为快捷灵活优质优惠提供周到个性化又充满的酒店订房服务。常见问答预订收费是否
bad	社会关系良好的有着。较多进项现额度因不了服务销售完成。每月每月一部分增值税电脑发票海关缴款书等左右和普通商品销售税发票电脑运输其它有
good	呜呜缤纷月日应该有个节日给不幸福的人试验脱光中兄弟
bad	教他们按照别人他们的那样工资去做一份稳定的得到。大部分工人而为和短期福利工作工作
bad	分析受训者使在市场中战略组织生产整体营销和财务结算等一系列的活动制定
normal	也得有意思留点的吧像风火连城和傅青主的变成如何旧谊矛盾
bad	软件同时营销送款。万元为企业业务提供服务群发代发
bad	性格安全感稍微能给人以的已经傍都小蝴蝶有着了
good	并会给以光盘形式快递一份。开户行深圳招商银行一卡通户主徐平开户行深圳市工商银行福田支行牡丹灵通卡户主徐平开户行深圳市建设银行龙卡户主徐平如果这封信给您带来干扰
good	换回了多真像做梦一样这时我才确信不疑。兴奋之余
good	销售网络遍布全国。随着全球电子行业制造中心逐渐向中国转移
good	堪称东方夏威夷。挖灶搭帐篷拾柴火捡贝壳海螺篝火晚会
normal	届时本开出可按您的要求把票公司并寄到贵司
bad	增长比年了数字电视研究中国市场报告对比即时通讯邮件中国市场研究报告产业年市场研究报告网络媒体年中国房产网站研究报告网络教育年中国网络教育研究报告互动社区年中国博客市场简版报告电信数据年中国移动中国联通财务年报告搜索引擎年百度财务分析报告网络游戏第五届网络游戏简版报告电信数据年中国网通财务分析报告该回复年您订阅的退订该邮件直接是请勿此邮件
bad	尊敬的商家朋友您好深圳市海华公司发票多家公司受委托外向低点部分增值税电脑代开左右和普通商品销售税发票。国税地税运输广告服务等票左右大小还来所额度数量做的根据商讨可以优惠的点数本公司郑重承诺所用长期有效绝对真票可验证是后此信息付款
bad	管人考核凭纠偏问题即时即时激励解决计划在现场反复反复抓事前抓
bad	绩效以领导促进有效彻底领导力如何发挥老师你的团队讲师带领陈顶立介绍
normal	查询如下状态网友个人说明档如下暑假。太阳水瓶天王星月亮金牛座摩羯座座金星水瓶座火星双鱼座木星水星土星天蝎座射手座射手座海王星射手座冥王星天秤座
good	就是单方面的也是。但是当时如不采取这样的方式
good	贵公司负责人经理财务尊敬的客户您好我司是一家集兴办实业国内商业物资运输生产销售代购代销等为一体的有限责任公司并与多家公司有合作有多个公司抬头
good	若贵公司有什么需要或其它问题。请来电联系更多详情请点击公司网站查阅联系人林立开手机传真邮箱网址深圳市维赖率狄涤邢薰
bad	其内容的精进反馈主要企业的来自与授课讲师的更新
good	如须进一步洽商详情请电小时业务热线联系电话邮箱联系人张盛顺祝商祺
normal	自游人推出特别户外运动俱乐部了本俱乐部五年前最早独创开发的徒步漓江狂欢西街活动
good	回馈社会还有很多令人振奋的消息会陆续登出。可以预见
good	研究领域包括公司战略组织机构变革企业文化绩效管理薪酬与激励等。年年
good	可上网查证或我司直接与贵司去税务局抵扣核对。彼此合作一次
normal	如何利用无铅壁垒造成的机会赚取窗更多的利润
normal	老牌劲旅汇集八一电影制片厂两岸三地实力演员
bad	各位朋友大家或许您经历好过下面这样的遇到。出差在外
good	网站招聘兼职网站宣传员月薪以上具体见附件邮件系统免费下载
good	如须进一步洽商详情请电小时业务热线联系人赵铭顺祝商祺优惠代开发票
good	就好像让我告诉某个人我爱你一样难为情。至少感觉是这样。今天是我的生日
normal	所开绝对真票。在合作以代办的方式提供到位的服务
bad	贵公司负责人经理财务深圳市华源实业有限公司我公司您好是
bad	我们的人平时冷静之余的强逻辑在思维工作分析
good	只是您选择对了吗中国加入逐步开放自由经济
bad	我们兴趣还便利为有和公司致力本网站服务的参予会更多的提供
good	共张。购买中国网球公开赛半决赛门票元一张
normal	贵公司负责人经理您好财务是我深圳市康特实业有限公司
bad	将您眉由此自己属于的家庭公司人与人差别拥有在背跤行动倏榍赴诘靥旰改蟪闪舜罄习澹坏背跤腥舜思盖榍苯墒校改旰蟪闪舜蟾晃獭腥担骸怂叭绻背岜人乙沧觯跷亲酶唷薄淮恚啵哪芰蛐肀人乔浚厩蛐肀人愕嵌验或许他们丰富比也
normal	而跨国公司做与规模能同时利润大本课程可帮到学习什么向中国成功企业您四大中国式赢利法则
bad	发票全国各大城市的各个行业的与公司业务联系有。庞大规模由于
normal	是我们在盘中根据未来的热点实时发出买卖指令
normal	将更多的中国更多产品的中国推进企业国际市场。注办附件我公司年全年展览计划表。公司主页联系人王艳群联系电话手机传真邮箱
good	林嘉欣也没多少镜头啊可怜我辛辛苦苦跑到东门外音像店
good	如须进一步洽商详情请电小时业务热线邮箱联系人陈惠敏顺祝商祺
good	在广州东莞上海等地区都有分公司。由于规模庞大
normal	男女都会发展成失败者男女还是最好摆正自己的位置要保留自己的尊严
good	掌握不定积分和定积分的性质及定积分中值定理
normal	担任。曾澳大利亚梅铎大学中国区采购总监。吴具有在外资企业的供应链管理领域老师十多年的工作狙椋岷隙嗄甑氖什僮骶验导和丰富的管理咨询经验
normal	深受国内众多厂家公司一致信赖。以下为本出口范围产品出口业务简介一提供形式的代理代理代理公司毛重业务商检植检产地证。代理服装五金制品电子电器塑料制品玩具木制品陶瓷各类工艺品鞋各种手袋箱包等出口。商品如贵厂家公司商品须本公司代理出口必须二准确详细的产品清单包装出口出口目的地净重报关报关的口岸箱数产品品名等资料。另外运输自付及费用则由贵厂家公司车辆。三贵厂家公司需出口的报检报关手续则由本公司提供
good	有丰富的电子产品和通讯产品的测试和实践经验。为某企业节省损失多万元。专业资历分会会员分会会员咨询电话电话传真报名回执表电磁兼容整改与对策深圳请传真到七五五八三一六六四单位名称联系人联系电话邮件传真学员人数付款方式转帐现金学员姓名为便于安排请将培训费用于开课前一周汇入我司帐户请按以下地址汇款汇款单位深圳市鼎韵科技有限公司开户银行中国民生银行深圳分行营业部帐号说明请认真填写此单
bad	如假乐趣大家包骂一起赚钱个人首先大家的给多多建议
good	成为年中国酒业最亮的新星。策划广东王老吉药业。年产品知名度飙升最快的要算百年老字号王老吉药业。一句怕上火
bad	很不够也。会体贴小事经常生气一些为不过。我他认为体贴我
normal	提供为此广交会了极好的平台。美国家得宝公司业务代表这样评价广交会我们经营公司的产品中
normal	应该以恐龙产业的蓬勃发展带动产业的同步增长
normal	但却很少感到管理者没有困扰问题。目前对正面企业客户需求多变企业生产规模的不断扩大库存控制大难度和仓库有限面积及配送效率低成本却高昂的现状
bad	对方麻烦来比较特别声明我女朋友不是找找或者老婆的好奇者坚决谢绝
bad	枪支又了以前打猎人的没收。下威胁人类它们没有对能构成足够的前提在
good	还有她的标题我的干女儿千金今天下午迫不及待不息千山万水去家看望我的干女儿小虫子是那么的可爱那么的袖珍比我想象中的小得多得多皮肤吹弹可破小虫子很乖
normal	可上网查证或我直接司与贵司去税务局抵扣核对。彼此合作一次
normal	它被引发中国必将引进中国企业在客户服务标准客户服务理念及客户服务体系方面的一场变革。通用电器
good	同时发生故障的机器数不超过的概率为由题设可知机器故障台数服从
good	这种牵挂能成为你抵挡侵蚀的盾牌。当我大二第一次恋爱的时候
good	实现从优秀到卓越本课程已为近千名知企业中高层管理人员提供训练及认证
good	贵公司负责人经理财务您好深圳市科英达实业有限公司。公司现因进项较多
good	再一个作文低于分倒扣分反正不知道谁研究的计算方法
good	节省话费爱车一族您开车吗车上免持可共享一张卡是您安全的保障商务人士经常往返两岸三地省内外国际间经商旅游人士时尚用户流行时代特征
normal	也有和他家人相处没有什么问题的关于买房子
bad	这也是宝洁的文化价值观念之一。思考问题的冷静
bad	事情清华来我那办法也是没有的欢迎。指点大家的谢谢
good	有着良好的社会关系。因进项较多现完成不了每月销售额度。每月有一部分增值税电脑发票海关缴款书等左右和普通商品销售税发票商品销售其它服务广告交通运输建筑工程
bad	进一步商祺如须详情请电小时业务热线邮箱联系人钟敬龙顺祝洽商
bad	平台给大家一个创业提供。电只要他人介绍优优网使用
good	便于读者留下真诚的意见和评论联系。欢迎各文友届时光临欢迎各位文友赐稿
normal	缡谢岬降犹故咀约旱牟呕拥有自己的二级域名
normal	说失掉中国人自信力了用来指一部分人到可以
normal	贵公司负责人经理您好财务是我深圳市华科实业有限公司的广州东莞等有市分公司。我司实力雄厚
bad	还这两年不满似乎招这个这么夸张没的拉上面清华的至少的据说都真实的可能有的学校招生简章公布公布的招生数字是是含水分的请注意我说的清华大学不是
normal	如有此项业务需求可来电来函咨询。祝商祺广州建兴贸易有限公司联系人彭先生电话业务贸易通
normal	收获很大。在此感谢贵公司的参加对我们同事培训工作的安排。统一珠海麒麟啤酒认为一直自我公司的销售团队是管理很不错的
bad	女性各界时尚爱美致及有品味男士购包的好去处韩国金姬美时尚包袋六里桥专卖店金姬美品牌韩国是袋业顶级包
normal	本设有在全国各地公司分公司广州东莞等有市分公司。因全国各分公司进项较多现完成不了每月销售额度
normal	呵呵原来这样过家家小孩子的过屁事了岁再讲这话鄙视就要我了
good	您将迅速了解业界关于无铅和绿色产品设计的最新动态
bad	后顾之忧为客户解决。板卡级维修交换主要同种部件的进行。机保修对于
normal	也明白了为何唐大我的让导师我选当代文学评论这门课了
good	非得等人家明确地告诉你你们之间是朋友。一般的男生是不会明确拒绝女生的。我没有觉得他人品不好
bad	我起床建议早晨中午晚饭午饭和休息学习学习下午下午锻炼和休息
bad	公益事业一个是致力于和爱心传播的学生社团。我们策划和组织这个名为彩虹用手划出
bad	打电话的不时问题接口的设计讨论。我找到了的的算法程序
bad	衣服时候舍不得给自己一件买。本科以前读的从
good	掌握换元积分法与分部积分法会求有理函数三角函数有理式及简单无理函数的积分理解积分上限的函数
good	被广为传播。蔡先生曾深入辅导和培训过的客户包括创维集团彩虹科技好利来集团新农化工鹏开电信万佳乐燃气大富豪家私北京网通格力集团华宁制衣兰江地产机构广西水电工程局等数十家企业集团。并在深圳广州厦门湖北新疆开展过的公开培训课程
good	到个用户就能够同时共享主机的计算能力和资源了地址北京市东城区雍和宫雍和家园号楼室咨询电话网址以上内容由免费软件发送
bad	上瘾还容易。里头天下贼无曾被打斗比如一时的一些简单的推崇和偷窃动作。国人不算了退化
normal	但是我的成为已心事一个心病。告诉能谁我是洪兴的让彪哥我来灌水的你要是不减肥怕是没戏有清华好什么的
normal	中国企业赢利研究模式第一人美国棕楣视高露洁邢薰狙翘紫葱泄北京大学
bad	照那样美国发展如果下去不怎么样也知道会。我们中国的文化瑰宝是
bad	学士占学位的专业技术与管理人才以上以上。公司销售网络与售后支持体系各地中国遍布
good	畅销产品背后的策划内幕职业晋身的有效阶梯
normal	并对培训课程进行受到。的认证在国际上认证广泛认同。其遍及不仅服务美国
normal	手机它一种基于现代移动通讯的新型的媒体。由于是是用户随身携带的个人通信工具
normal	编号更新日期计算机工作年技术部狙本科北京雷正琴女岁手机出生日期年月国籍中国户口所在地评价自我湖北省荆州政治面貌团员职业目标自我评价熟悉操作平台
normal	最新窃听监视透视设备迪克国际隶属电子科技迪克伟业国际集团子公司。专业经营最新高科技电子产品业务
normal	同时为生产厂家和供应商提供一个销售产品的优良渠道。欢迎各位客户前来垂询
normal	以下文字转载自讨论区发信人精灵信区标题能这样写数学公式吗发信人精灵信区标题能这样写数学公式吗。如果是一个矩阵
good	对外优惠代开部分增值税发票和普通发票国税地税建安运输广告服务等按。还可按所开金额的大小商讨点数的高低。我司本着互惠互利的商业原则与商家朋友建立良好的合作伙伴关系
good	他们都是一开通立刻工作也就是说我上面计算的收入太保守了
normal	所开的用税额海关缴款书在当地税务部门已抵税
bad	教研组不心血付出为我的顾及。研究然后说你不能再为实验室要是作
normal	推出为您我们独创的快乐工作坊快乐组建门店队伍营业队伍中是否有着适合但不优秀的
good	躲不掉。弄的师妹每天躲在实验室不出来。象这样死缠烂打的人
normal	同时填补了物理灭蟑叩墓诳瞻住环保型蟑螂捕捉器的投资与特点性能少
normal	可上网查证或我直接司与贵司去税务局抵扣核对。彼此合作一次
bad	问题企业对的分析和研究准确实际。技巧课程职业经理人资格认证品牌擅长领导力训练销售精英特色时间管理目标管理企业文化团队管理沟通建设全面服务管理等。李教授以培训式见长互动情景培训培训为
good	贵公司负责人经理财务您好我是深圳市步步顺实业有限公司的
good	欢迎来电查询详情请登陆网站或将行程发送至此信息如果给您带来不便
normal	起步起码晚好几年理解能发表意见你的父母的想法我不我
bad	商之一中国实力最具的软件开发商和系统成为集成。公司国内于股在年底股票代码上市为。目前资产总滴亿人民币
bad	保证标题他以后了不会吃饭关于做饭的事我们家问问比较简单
good	我就只有张着嘴崇拜的份了。才想起我高中计算机竞赛的时候一道有关命令的题没有做出来
bad	我司服务大小全方面的提供。可邮所额度数量做的根据点数可优惠的衡量。来电欢迎来来郑重核对所用票据验证绝对承诺税局通过或上网能联系电话联系人杨有军佛山市联兴有限公司广州东莞等地分公司有
good	全力打造你的一流英语。培训对象有一年英语基础
bad	更妙的小人它将已经是能广告区的走入抓回来继续干活。本软件非常无人对于时的监工有效值守
bad	它完整行为可以公司员工收发的电子邮件籑等聊天的内容和传输的文件记录全面员工的各种上网了解
good	你在农村见过这样的媳妇没有啊你要她干吗还为她睡不着
bad	谁养大父母不是的啊关键给这些你是也了丈夫的爹娘了吗自己的爹娘说他们就是没
good	敬请原谅顺祝商祺深圳万丰源有限公司优惠代开发票
normal	讲授需要经理人系统具备的各项基本管理技能。从理论提升与经验三个维度全方位技能管理人员素质。是目的在最短的时间迅速理解掌握实用的管理技能提升管理绩效促使其转变观念达到改变行为的目标
normal	贵公司负责人经理您好财务是我深圳市华隆源实业有限公司的广州东莞等有市分公司。我司实力雄厚
bad	胡珉先生受邀成为每年一度的国内物流专业研讨会两个论坛的主要讲演人此外
good	可上网查证或我司直接与贵司去税务局抵扣核对。彼此合作一次
good	个月前因为种种原因分手了虽然劝自己不要再想她了
bad	致贵公司财务部有限公司广州市荣泰贸易您好
normal	但是能感觉到吃药她这几年来她的减退在慢慢性欲
normal	即六维管理。找到让门店员工快乐执行的激励系统管理秘诀
bad	我哪突然又。选择那么自己觉得他无奈的像是。他朋友问题和还一些男人出轨的讨论
good	连指甲都破碎了后来她终于昏倒在农民垛在打谷场上的草堆里
good	善于引导学员思考从而达成培训的目标。对企业管理与人力资源有深入的研究。曾培训或咨询过的企业有香港艾伯国际集团中国石化现代集团深房集团深圳中汽租赁有限公司深圳恒波通讯深圳华展国际三洋机电中科诺集团奥林巴斯新华强眼镜中华厨具三洋电梯顶星科技联邦快递深圳津村药业翔龙通信广东浮法玻璃中兴通讯等。吴建国香港光华管理学院客座教授澳大利亚悉尼大学
normal	。提供将对上述实习工程师公司技术与产品的培训。总裁国内商务助理名要求端庄仪表
good	使开发生产服务水平跃上新台阶。中钰公司秉承用户第一
good	因而作为一个合格的职业经理人一定要有企业文化的观念和意识。训练摘要什么是企业文化企业文化的作用如何培养推动公司企业文化的建立和发展。管理技能十二职业经理人要注意的几个管理误区职业经理人在工作中经常会忽略的几个管理误区
bad	广告一边该公司发送过来的接收其就此外长短上网时间按可以每小时满注最低标准的报酬美元美元付款即会获得
bad	电子邮件营销恢种上国际很流行目前的一种网络营销方式你是能我们的邮件且收到就鳎缱佑始悍该偶胫稍诩纳桃低乒阈幽诮吧桃倒愀娣偷绞蚩突缱噫畔渲校恍瓒苑酱蚩畔浔憧煽吹侥纳桃敌偶墓愀嫘耆梢杂肽鸭甘习偻蜃式鸬墓有愀嫦懊溃杀局恍杳扌胱旒冈纳贤延谩壹虻子茫刻丁菊抵臼展毫送暇蠖嗍始牡刂松秆罚辛。偌由献约核阉鞯挠手殉晌罚个畲蟮挠手酚晕镉兴怠本站所有邮址亿献
normal	看看在我原文。。去要标题男友家拜见他的父母了
normal	会立即用给收到回复确认。若作者没有及时作者确认回复
normal	严格为保密确保承诺交易的安全性本是公司所开具的发票绝对商家真票可验证后付款欢迎来电咨询联系人张生业务手机顺祝商祺优惠代开发票
bad	能力再提供的网络式调用仿真分布计算加上等等。整个产品链协同式能够了赛特而独特的达集成设计并能平台技术平台优化和用户的软件相辅相成价值链形成一个完整的形成。公司提供的社保福利五险一金此外
normal	意味着这就要在生育前后有一年左右的时间在家
good	以便给您取消国内专线联系人郑小姐国际专线联系人韩小姐如果您想成为终身制金卡会员
bad	确实比较烦人本软件的功能监工就是一个自动角色的充当
good	鼓励一下还是让姐姐们给你解答更好吧。赫赫
good	这她都知道。然后她刚开始就对我不是太放心
good	如须进一步洽商欢迎来电垂询顺祝商祺深圳市建深实业有限公司联系人柯昌军手机电话
good	真实感。这个创意还不俗啊。。不足之处也很明显
normal	要从多方面。不是只看是不是能读好学校。也不应该带着有色眼镜去审视家庭富裕不好成绩的一些留学生。有时候发生也会更经常的歧视在面向所谓的强势群体。首先
normal	提供向客户我们的包含地址国内互联网邮址的以上
bad	社会关系良好的有着。较多进项现额度因不了建筑工程销售完成。每月每月一部分增值税电脑发票海关缴款书等左右和普通商品销售税发票商品销售其它服务广告交通运输有
normal	符合更界面使用中国人习惯。按实际点击收费
bad	你外面应酬在却有没能而一起和又我。月过了一个过
bad	每次都因为五一和去十一谁但问题谁的闹矛盾看
good	我劝告年轻人在寻找工作时要看看能从中学到什么
bad	管理体系一个完整的构成。三使命和目标胜软件中国创造实现是和幢科技的使命和奋斗目标。同时升级企业规模谋求不断发展的在
good	也不知道有多少孩子会因为影片中天敌海豹在水下追逐企鹅的画面而毛骨悚然
normal	小人物的湮灭便如同沙尘一样容易姓名。但是
good	是您能达到瞬间开启。本工具保修一年。声明本网站所有产品均为娱乐所用
good	为确保您报名无误请您再次电话确认如您在工作中有疑难问题
good	可上网查证或我司直接与贵司去税务局抵扣核对。彼此合作一次
good	系统讲授职业经理人需要具备的各项基本管理技能经过有目的性的训练
bad	质量判断对而没有。我读其实了两年还不标准都学校知道是这样毕业规定的。时候我知道的当
bad	贵公司负责人经理财务分公司我您好深圳昌隆实业有限公司的广州东莞等市是有。我司实力雄厚
bad	巨大理念学员先进财务管理带给和方法的冲击总是
bad	上网可查证直接我司或税务局与贵司去抵扣核对。合作彼此一次
normal	选出了两个开发新产品的提交一是种在原有产品上以加强最认可的产品性能从上一轮对的调查结果得出为基础
good	将帮助企业培训经理及主管全面掌握培训体系建设的知识与技能。本课程能够给学习者带来的收益掌握培训需求分析的技能
bad	贵公司负责人经理财务分公司我您好深圳市鹏辉实业有限公司的广州东莞等市是有。我司实力雄厚
good	还可以根据贵公司所开的数量大小来商讨优惠的点数。本公司成立多年一直坚持以诚信为中心作为公司的核心思想牢固树立公司形象真正做到彼此合作一次必成永久朋友。更希望有机会与贵司合作本公司郑重承诺所用绝对是真票贵公司在发票真伪方面有任何疑虑或担心
normal	了解订阅详情。职位名称公司名称工作发布地区日期市场拓展主管北京卓达百人行投资顾问有限公司北京市市场纠恚上海安美仕人力资源信息服务有限公司北京市公关纠世纪人才系统有限责任公司北京市客户纠北京道康市场咨询有限公司北京市茶叶事业部纠北京天月华夏茶叶有限责任公司北京市更新或取消职位职位
bad	数据包括咨询与研究报告行业咨询等。任务公司的其他工作完成。专业知识和技能电信要求良好的互联网有以及企业管理方面的知识背景
good	他却一直混得不如意。出国的话他现在的背景未必能去
bad	销售而国外模板的不是简单。欧美韩国日本网站都不错的原创模板交易有
normal	持续赢利的管理是连锁专卖店实务研修班中国深圳年月日门店人员运营总监营销总监销售策划经理经理店长督导等培训方式互动授课案例教学分组研讨实战演练门店参加连锁企业的基础利润来源
bad	给黑子个什么取阿黄虎子发财或者富贵之类俗气的名字。我小人书了看过曾经的一本想起
bad	就任何一个注册你的一级代理在网站的通过代理会员你的二级成为
bad	能工资收入才您的非增加。内容大声机会读出市场风云卡和额外支出卡上的卡
bad	那样的话不错我的给感觉很好的远离非典不是。。。。呵呵。
bad	一次性迅速拷贝然后老手机上的资料把上可以新卡复制到
bad	欢迎您非常写这些将和体会心得出来投稿投我们给
