good	所有报酬完全来源于产品的销售提成。诚邀热爱网络
normal	小怎么在这里也看到哈你你看是不是编程更是和科研风马牛不相及我也不会我呀
bad	费用自理。五联系方式联系电话来电欢迎登记报名表格传真号联系人杨先生梁小姐报名方式电话索取转帐会务确认函发出报名
normal	这样写合适吗承认找出这种我我不能写法自相矛盾之处
bad	会他你对的失望逐渐也累加而舜幽诙庹展功课淮缂最重要秋季的美体嗣恳
good	也有可能怕说明白了大家尴尬做不成朋友。怀着很善良的心态看
normal	成了我们研究迫切需要和解决的重大课题。课程面临从国内讲解所特色的实际涵盖出发结合企业本身现状与讲师年供应链问题采购物控生管仓储交货等管理相关咨询与多家企业经验的企业通过众多企业在供应链管理方面的成功经验及失败教训的体会和分析以及模拟现实环境的操作演练
normal	而是依靠一整套拥有核心竞争力的在低风险情况下追求长期稳健获利的操作体系
bad	国家和国家差别大了现在我还计划虽然具体的出国没有
normal	敬请原谅尊敬的商家您好朋友我是司拥有全资十多家下属单位的大型集团公司
bad	没有并且它最后的还有我的那张照片希望也了
good	并非担心见面之后她在我心中那个美好的印象打折扣
normal	请有用肯定对您们保存如果这封打扰邮件了您
normal	报名参加教育同伴的旨在以及相应的进行锻炼和实践。活动帮助包括应届毕业生在内的全体清华学生了解国内就业环境和人才状况以及各行各业的发展现状和对人才的认清要求个人现状
normal	领导开展团队工作。其他相关任务。直接对总裁负责。
good	无法将您的邮件投递至以下指定地址投递失败帐号不存在
bad	留位单位名称给予支行传真培训部到请收联系人联系电话传真学员人数学员姓名付款方式转帐现金支票现金人数人费用总计元付款方式电汇转帐支票参加请请户名广州北鸣咨询有限公司帐号开户行广州市商业银行东圃打
bad	我公司手续都正当有。业务有希如以上要的公司向联系请我司验票主管人员。本公司厂家所有公司厂家向承诺先付款后
normal	可以按一定比例提供融资服务。要求资金加合计市值在万以上
bad	有时候同的。都婚姻年纪自己快要撑不下去觉得了
normal	定期为企业制作行业我们和薪酬分析报告保证以专业的服务向您人才需求绝不让您的简历石沉大海绝不让您的公司一将难求有事儿您我企业专业人力资源秘书跟踪服务
good	虽然我不是完全赞同他的意见。写作文特别培养思维能力。我为了写作文
normal	我有都承诺正当手续。如要有希以上业务的公司请厂家向我司主管人员联系。本公司向所有公司厂家公司先验票后付款
normal	怎么办呢她不是小振小女孩了肯定不喜欢啊大猫个情侣的东西她一个你一个买买个可爱点的毛毛熊
bad	宠然大物根本野猪比判断能否过这个要它倍大几它的敌。还红毛在时候没有反应完全过来的没有
normal	快乐工作的有与方法对我的工作理念非常大的帮助。昆明鹰王文具连锁总经理郭雷宏热烈气氛
bad	你真实就会这一说法明白确实了某种程度的道出。纯粹的结果越雷池一步大部分工人是从不
normal	不允许一个人自己在到他家。于是我我楼下等。点到他楼下
bad	直接它的维修能力和维修影响速度因为板卡级维修速度和整个维修成本
bad	男生要心思都每天一番花想出个话题交流与短信
normal	所以多么金贵多么无所谓对我来说也贵族表吗
normal	觉得我还是想很不成熟如果你你表达自己心中的不悦
normal	但堑闭飧捣沟乱鍪搅艘欢锥幸惶魏螅旒词鼓悴蛔隽耍够嵊幸惶字贫壤幢夏悖窘枰梢云母冻郧暗龆绦竦梦榷木济回报。卓越正是系统创立较早领先全国全国的帮助人们开创个人事业
good	什么都不懂真的谢谢一定要坚持打赢这场争议的战争
good	并且先用票后付款。欢迎贵公司来电洽谈。联系人林先生电话
good	一定要优生优育可我觉得我相貌方面还算可以啊
normal	不同其方式和学习途径也非常讲授。在这里集中我们了国内最权威的教师海淀区教研员新目标英语教研组施文雪老师史晓昌尤丽华老师海淀区英语学科青年学科带头人张金梅老师新目标英语教学参考书编写者之一周莉老师清华附中优秀青年英语教师陈建荣老师等一起精心制作了精彩的网络课程
normal	普通发票国税地税代开范围商品销售统一发票广告发票运输发票其它服务发票餐饮发票建筑安装工程发票酒店定额发票广东省商品销售衡量等可根据所开数量额度的大小来发票优惠的点数
normal	用于弥补挽回网络泄密造成的损失。保护如何网度安全数据最全面的邮件监控可对各种协议各种工具收发的邮件进行记录
normal	报名赠送即全科机工版教材全套及内部独家资料机工版数学习题详狻顾筒嗤咸蚊苈只糠耄钣邢蓿铀伲由中国网发起的年度中国最佳考前辅导机构的评选中
bad	库存交货对款式价格人民币期天运费编号鞋最新流行不含
bad	学习终生改变将你的永远这个世界不变一生的变就是
good	本公司有全国各地发票可以优惠代开。普通发票为
bad	对封装技术以及无铅元器件元器件的工艺要求
bad	不上网且影响注册免费一边玩游戏现金一边赚
bad	你只注册可以不游戏却它的参加呀上广告条跳出启动时的网页鼠标比如点击
bad	已经他同学短信果然了两条发出发他问是否。他接过来看
normal	惊喜真的好我。不好意思的拿出了一个块钱的戒指送给我
good	他们说每个电脑上都必须有一个操作系统我真是愧不如人正在我决定鼓起勇气后来跟上
good	根据山东省信息化工作领导小组办公室制定的年工作重点
good	会务和文化等交流活动。年月份秋季大卖送旅游活动简介如下海南海口三亚成都九寨沟黄龙贵阳黄果树南江峡谷漂流桂林漓江阳朔张家界天子山索溪峪猛洞河云南昆明丽江大理版纳香格里拉北京北戴河承德大连青岛旅顺烟台蓬莱威海浙江地区临安杭州安吉莫干山千岛湖等华东地区上海苏州无锡镇江杨州南京等欢迎来电咨询我们特优的价格和一流的服务。总公司地址上海市天目西路号锦程大厦室靠近上海火车站联系电话联系手机
good	现在在北京打工做保安他父亲让他辍学的同时
normal	无复出描述。树草木以象山。关于机关和水银的大家耳熟能详都者了
normal	统计分析员工的有效工作时间。可根据时间角色行为进行审计更可根据关键字进行所有信息的分析实时报警。完整的统计查询与提供可报表多种形式和手段的统计报表查寻功能
normal	赠送将免费我们以下讼钐非居訧备案提供免费为主机用户姆瘢非经营性备案
normal	包括产品电话通话内容监听器移动电话拦截系统跟踪超透视远程窃听器微型随身窃听器世界上最小的窃听器窃听器监视滤镜眼镜高性能隔墙监听器电子追踪器电话传真拦截器针孔传送超远程摄像机卫星全球定位系统游戏机反遥控掌中手机手机定位器电动万能开锁器隐形墨水万能钥匙针孔消失定期照相机笔电表控制器信用卡设备手机窃听器骇客手机
normal	参与编写多部教材和文集。曾获校级优秀辅导员奖。第三场嘉宾简介良师益友白峰杉主要个人经历英国大学数学学院
bad	流失业务引起烦烦烦只要一号通其实一个神奇的通搞定就可以申请一号申请
bad	数理不平作。业务收费一全国通用增值税发票海关缴款书如下左右。二国税全国通用普通商品发票收费左右。三代开可各种地税发票运输发票其它服务广告建筑安装等收费左右。成立我在公司多年坚抒一直信用以
normal	请先让自己浮躁的心平静下来。扪心自问在你生命中
bad	设计能够更多的国内设计师吸引模板我们自己的中文原创网站属
normal	有着良好的社会关系。因进项较多每月有多种普通发票国税地税发票增值左右和海关专用交款书左右向外优惠代开。还可以根据数量的大小来衡量优惠的点数。欢迎您的洽谈来电本公司郑重承诺均可票据上网查询或抵扣验证
bad	您费心不必人员去培训和管理专职的网管等招聘
normal	偶来了精身偶的搁在金身哪儿了欢迎大家来版参观
normal	可远蛉悍赠送各类群发软件切割搜索软件发布信息软件邮箱邮箱软件邮箱过酥馗慈砑妓阉饕说明嫒砑募允俏锍提供凶嵛各类软件的详细图解锹
bad	套房个小买借钱还要。奔波不您还中生存创业工作知幸福追求努力家庭和孩子的为了而烦恼是否是否吗发愁而为资金没有是否而失业下岗合适找不到的今后为是否为为工作就业而是否您收入额外想有想您想过在您的一生在
normal	也就是通过进行对远程客户端服务端一对一管理
normal	将在清华主楼后厅演讲。为了让没有机会去看的了解实时到现场的情况
normal	让我们很容易按照公司的实际业务情况在最快的时间妥钚某砑信杀灸谛薷娜低耆疽滴支持单证技术
normal	尊敬的是工厂经理你好负责人我公司公司一家多年为外资企业代理进出口业务的公司
good	他无意中自己说出自己的密码现在换成另外一个。我就要他告诉我。当时气氛很好。他先是不告诉我。我就故意装生气望车外。后来他就悄悄告诉我新密码了。两人闹着玩
bad	我没有提起也。只老师成绩疑问我的体育对不过了提出
bad	越来越保证信息网络及数据的安全重要因此。专业的服务公司
normal	并留下一个特别美好的回忆。点的敲响悠扬地钟声
good	考上大学后就学校管吃管学费还发钱社会资源已经够倾斜了不倒翁拜托
normal	做出骄人的业绩联系方式工作性质全职截止日期招聘人数人月薪范围面议工作经验年学历工作描述北京职位地点及要求职位描述负责无线通信系统设计定义和仿真包括物理层估计波形设计信号信号和检测干扰算法对消信道编译码链路层协议和协议负责新技术研究和跟踪
good	这样做的初衷是为了保留作者的本来情绪。我不想去压抑他的表达
bad	我清楚三里屯到半夜有了解的吗毛怪物也谁不担心其实
normal	小时为给提供贴心专业的翻译服务。您仅需您我们一次免费为您服务的机会
normal	续费投放。人民币充值充值全球开设客户独立后台
bad	查看请完全手册注册下面举例怎样打包还可以看广告条动画的注册演示给鼠标上启动时弹出自动的网页在你点击
normal	了解和分析客户的新需求。解决相关业务与技术的编写维护系统方案值班指导记录与培训客户人员。跟踪国内外存储与备份及相关技术的发展趋势
normal	中国的是文化建立在家族血缘关系上而不是建立在一个理性的社会基础之上。中国人只在乎直系亲属他们的福址
bad	思路了开拓与视野。今后进一步在重视决心工作财务对的加强与把握。上海瑞佳建筑装饰有限公司中国区总纠刘先生好很老师总结已出我们知应的财务重点深入浅出灌输地而且介绍
good	我已经无可救药的爱上丰满的大了。那不用娶回家吧为了玩流氓理想主义者没用怎么解释彻没用的猫眼多少看起来很健壮的男生还没有生育能力呢
good	海关缴款书为。详细点数根据票额洽谈注普通发票包括运输租赁广告设计建筑安装其它服务商品销售电子产品五金交电仪表仪器机械设备塑胶制品化工原料医疗设备人行幸捣薄亟煽钍橐院卮魉笆眨耆梢源嬖鲋邓胺薄本公司实力雄厚
good	要看清晨梦醒时的一刹那表情。看一个人的胸襟
bad	尊敬的阁下我们正在调查现在一项状态青年生活关于的开展
normal	即可使用。登录了解开放免费详情试用帐号供下载。马克数据工作室您如果不想广州市拓赛网络科技有限公司再收到我们的信件
bad	你去了出国孤独必定。我很很就你这样的人高兴奇怪怎么呢你后悔会的。我不不有点了。一个人错误你的选择说是的
bad	支持作为和国家的还有。你成果博士生学习阶段结果的属于正教研组学校和国家。我们专利如同学校职务发明的作为属于学校一样。你在等方面取得了取得
good	我无法相信这是一个事实。看了太多关于假乞丐的消息
bad	亚洲首富孙正义丁磊这么年轻为什么内致富短短时间在能
good	先后担任过研发工程钅烤理技术总监等职务。周老师有丰富的产品开发实务项目管理经验
normal	电子无应对该如何企业和制造导入铅电子制造无铅辅接啜训讲时间年月日剿地点账罩葜猩酱笙主办单位智慧树管理网费用元人天含会务费证书费二日帮可中餐您预定酒店授课从事对象电子产品的工程技术人员
good	支付账单。还有另外一种可怕的管理理论这样说工人付出最高限度的努力工作以避獗唤夤停椭魈峁畹拖薅鹊墓室苑乐构舜侵啊如果你看一看大部分公司的支付额度
bad	站自助建您问题为就了这些烦人的解决后台你让拥有网站轻松轻松自己的管理。免费试用网址喜讯购买本月系统网上支付送
normal	没有学不会的人六岁的老人和六十岁的学会当场拥有神奇之五小孩她
bad	我从竟然到了。真的我心仪的一个女孩而一个外转来系的到了系的第二名。心里很痛名
bad	尊敬的商家朋友并深圳某拥有您好一家是全国各地口岸进出口权下属单位全资集团公司十多家拥有的大型集团公司
normal	建筑安装运输广告咨询服务业和定额发票等希望真诚地合作能够与节约本司也可为有贵司一部分资金如果贵司在发票方面贵司任何疑虑
bad	找说我让以后帥一定介绍像一样得的。我家先一下我家
normal	但是难道说他的别的话相信都不能觉得吗我我观点一个人的找首先从别人的人品上去是问题反驳一件很人身攻击的事情。无耻无耻
normal	公司捕捉环保型是蟑螂器蟑螂最新骚扰人类与传播疾病的公害危害直接之一人类的影响严重生活身心健康人们和环境卫生。必须坚决消灭。为此本推出最新推出环保型蟑螂捕捉器。通常药剂蟑分为可方法两即大类化学灭灭蟑及物理方法灭蟑。前者较大危害性且不安全
bad	我们研发还有制造市场专辑专辑专辑信息专辑人力专辑企业文化专辑及各行业专辑资料备索
normal	如须进一步洽商详情请电小时拒绝热线邮箱联系人林家辉业务业务闲聊顺祝商祺深圳市顺通实业有限公司
good	他将是您最有威力的改善工具。本课程以美国质量管理谢的绿带知识大纲为基础
bad	安全性交易的确保。本公司发票所开具的承诺付款绝对真票可验证是后来电欢迎验证联系人陈生手机邮箱顺祝商祺深圳粤泰集团公司代开发票咨询后付款
bad	贵公司经理财务您好深圳市春洋贸易有限公司东莞分公司我司优势互惠互利的本着和良好的社会关系
good	展示信息技术在各行业各地方的应用成功典型和解决方案。配合本次大会的召开
bad	主管曾生产班组技术员长生产担任。目标管理法生产在单位推行和管理现场成绩了良好的取得。管理层后进入
good	本公司在全国各地设有分公司广州东莞等市有分公司。因全国各分公司进项较多现完成不了每月销售额度
bad	本公司可以合作完全贵公司的依照需要来进行途径合作至于
bad	戒定慧好傻的帖子以下文字转载自讨论区发信人呵呵
bad	学习于是决定就他跟着。老师找好了面试之后一个还有
normal	但是现在真的很伤心放弃还是坚持呢给大家个建议吧其实喜欢真的很我她
bad	男人不可以强烈第条快乐新生活管不要也是要么女孩子就面子我这样家务面子小蘑菇也。。。这你说哈哈怕不作道理就要大听怕怕
bad	就却去下次了。自学自己后来想又教没有老师没有
good	对企业管理有较深入的研究。王老师主要从事技术应用成本控制管理会计决策等课程的讲授
good	欢迎来电查询详情请登陆网站或将行程发送至此信息如果给您带来不便
good	快速发现企业潜在而紧迫的培训需求。掌握培训课题开发课程设计的技巧
bad	我疯掉几乎要了。上中国火爆最的外贸论坛在
good	保证了双方信息的安全。操作简单界面设计吸收了和的优点和使用习惯
bad	为错误自己知道了个极大的犯。他欠发明者的米国王游戏苫褂个格子空着呢国王数了这个终止
normal	就招你读研就是自清华小考如愿的一个梦想但是我现在还没有大都我了
normal	哈哈向收捕的问好朋友们啦我站我在哪一头。。发信人独立小熊信区标题标题鸟了说先是被人家松松尾巴上没毛
bad	这原因问题上述造成的正是。不同国内一些培训与的是
bad	看来他们应该他们更如此的儿子一个在找到优秀优秀的和女朋友
bad	剩贠现多家企业高级为宋建设管理方面企业文化管理人力资源管理营销策划等现代企业管理
bad	丘他几棍子就让闷结果村民晕了。后来再的那些给
normal	成为参加广东省全国鉴定职业技能统考最多人数的职业。一些行业和大型企业集团
good	并增加夜间灯光娱乐活动。空中观光区包括轻型飞机和空中动力伞
good	现有部分结余普通发票可优惠对外代开如商品销售发票广告发票运输发票服务发票建筑发票等点数从优本公司郑重承诺所用票据均为各单位在税务局所申领
normal	职业绾畏纠砣挂恢哦呢训练对摘要团队的几个误解团队处理组织角色与团队角色角色团队冲突的几种方式。管理技能十一企业塑造文化任何一个公司的发展从优秀到卓越从根本上讲是公司企业文化的形成和发展的固化过程
good	他妹妹也出去打工。前几天他看到了北大青鸟的招生广告
good	广东友邦贸易发展有限公司致尊贵的商家您们好公司处于为各商家节税
normal	可上网查询或到税务局抵扣验证。联系人详情请张先生电
normal	以及进行重载的可能性。在对重载理论作简单介绍后
bad	问题大家积极都踊跃的下课新奇的讨论。课程的评分方法很特别也
normal	贵公司负责人经理您好财务是我深圳市华源盛实业有限公司的广州东莞等有市分公司。我司实力雄厚
good	专职芬搿肷余名。可提供的服务语种覆盖全球余种语言
normal	采用能不能愿另外一种方式我的悄鄙涣住臀乙国王只是一粒米惊讶很我。是的
good	你不是汇编码。标题用什么软件可以做一个物体沿着某个轨迹运动的动画这是正解用做的漂亮我是这是兔子送我的可乐口渴的时候大口大口的喝
good	为要冲减进项。现有增值税电脑发票对外提供
good	了解二重积分的中值定理。掌握二重积分的计算方法直角坐标极坐标
good	非常重要的一个因素是拥有一支合格的职业化程度很高的职业经理人队伍。要想成为合格的职业经理人
normal	不得强制收取。以前有关学生住宿费的抵触与本通知相规定的
bad	我司负责每一位客户对都会相关专业的工作人员派出
bad	花就你剩下给六百了吧。火冒三丈我听得。六百块钱说多不多也
good	可能也是上了一点麻醉吧。后来看收费单的时候
bad	大小还来所额度数量做的根据点数可以优惠的商讨。公司成立多年中心一直坚持以诚信中立足于商场为
good	这就是邮件营销。正如您收到的这封广告邮件一样
normal	获取可以重复性的它芾矸问延谩杖胗攵啻纬中允杖耄欠了解褚丫其差别了但是在今天
normal	网上见分晓注此项高层只需公司知道方案即可仅付月租元月
good	点数较低。还可以根据所做数量额度的大小来商讨优惠的点数公司成立多年一直坚持以诚信为中心作为公司的核心思想牢固树立公司形象真正做到彼此合作一次必成永久朋友本公司郑重承诺所用绝对是真票更希望能够有机会与贵司合作如贵司在发票的真伪方面有任何疑虑或担心
good	我一定不要成为天平座沉寂的风每年的月不是光棍节吗阿恩
normal	掌握已经供了丰富的数据现在我们将年最具有潜力的股票我们广大用户分享
good	贵公司负责人经理财务您好我是深圳市康特实业有限公司
normal	提供试用版斓氖杂闷谙蕖杂冒沧沸蛄靶枰泻牛魅胱鳎汗久疲镜刂
good	另我不到三天就超过点了第个月收入元元元第个月收入元元元元第个月收入元元元元元第个月收入元元元元元元第个月收入元元元元元元元怎么样
good	每个月有剩余的税票可向外提供还受多家企业公司的委托互惠互益以解贵司业务运作补帐作帐冲帐中的燃眉之急提供如下票据服务普通国税地税商品销售运输广告建筑安装其它服务类型税票等为税点增值税海关专用缴款书与增值税的方式一样抵扣为税点还可以根据数目的大小来衡量优惠的多少。注所有票据均为税务局代开或由企业直接开出并可上网查询或税务局验证后付款的方式与贵司合作此信息长期有效
good	供贵公司财务做帐及抵扣可以验证后付款。代开项目如下国税普通商品销售发票地税广告运输建筑安装及其他服务行业发票增值税增值税发票及海关缴款书简称海关完税凭证如有需要请来电咨询联系人王先生电话手机
normal	而有些收入是则来源属于持续性的收入。问只要您自己下面这个问题
bad	电磁兼容工程实践及案例两天高级研修班日期年月日地点苏州中山大厦主办单位希锐企业分析咨询开课时间年月日管理
bad	导师不管钢琴课跟不好意思。才之后后来宿舍对门的硕士生知道了选他们导师都都。说我们待遇为什么如此受到没有法语却计划加到培养把遗憾可是了我的成。学期一个新有我课去了第一节法语旁听就老师就说
bad	华人推崇最为的实战型培训专家尊称被人风采中国管理教育第一人演说家的为
good	几年后成了大老板当初有人带了几千块钱杀进股市
good	营销管理网企业宣传与产品推广的好伙伴网站超低价万年中国企业名录大全万年中国老板手机号码亿年邮件地址库大全房地产管理资料大量下载房地产行业市场分析
bad	去独立日还是垃圾片看吧。就怎么一下场面突然了结束爽还够没有呢
good	但有代表性反映人性光辉的百万美元宝贝雨人黑暗中的舞者欧洲电影以记录片反映枪支和校园暴力的大象反映创作者对美国霸权态度的美国站队虽然有调侃的嫌疑反映执法现实的训练日神秘河反映青年人的颓废状态的猜火车欧洲电影其他国家的去年嘎那有个描写人弹的电影还有伊拉克人拍的关于伊拉克的电影还有很多
good	向生产设备提出零事故零非计划停机时间零速度损失零废品的要求。除了推行和贯彻全员生产维护的思想外
normal	请务必转达贵司财务或经理如果打搅我们了您
bad	总和也许每个人社会交往的是。手机丢失极易失窃
bad	进一步商祺如须联系方式详情请电邮箱联系人杨国雄业务顺祝洽商
good	所以我很同情你的女朋友。当我最后用熟悉的键盘敲下这个温馨的名字的时候
normal	可上网验证或直接去税务局验证。此信息长期有效
normal	第二年以后利润每年思想。戴明博士的中心就是芬环每天进步世界强是企业如何管理的请看编纂与新加坡翰林企业管理学会联合深圳市英扬科技开发有限公司的世界强企业管理实用标准赠送另免费文档万字的总纠肀洹内容包括份文件
normal	尊敬的女士您好先生是我一位热情有进取心和责任感
bad	镜淞鳎本站最新公告本站资源正式厦门中代理的域名空间注册服务速度迅速一个国际域名空间高速含的登陆只需元拥有当日开通飞快盗我们共同努力让蛟熳放似朴砑。。网站请网站电话详情查看
normal	本坚持自成立多年以来一直公司以诚信为中心立足于商场中
bad	我们两个人时刻一起一个甜蜜很的度过。过来给发短信中午蛋糕他师姐说他他买了
bad	开启您是能达到瞬间。本工具保修一年。所用本网站所有产品声明均为娱乐
normal	保持有效产出如何提高生产管理系统的减少如何柔性运输时间
