good	及中高级人才交流项目成果对接人才论坛及西部商贸考察活动于一体
bad	每年都他十分失望但。不得不他学校于是回到资格去高更的学历获得
good	业绩蒸蒸日上欢迎来电咨询谢谢联系人张庭飞手机邮箱
normal	但申请电信的固定的需要却地址花费一笔不小数额的费用
normal	中越号界碑北海银滩活动第一队月时间日月日第二队月日月日行程体育中心晚上深圳市集合自游人户外运动俱乐部计划
good	我一定不要成为天平座庆猪猪还要长一年分还不到一个月经历不同结果是一样的但是第一个一个人过情人节就当没有这个节日了给爸妈问声好祝福他们快乐吧相似的经历相似的感觉不过时间比你还要长三年我也有同感即使他有了家
bad	产品电话包括通话内容监听器移动电话拦截系统消失远程窃听器传送窃听器微型随身窃听器世界最小上的窃听器透视滤镜监视眼镜高性能隔墙监听器电子追踪器电话传真拦截器针孔摄像机超远程超卫星全球定位系统游戏机遥控反掌中手机跟踪定位器电动万能开锁器隐形墨水万能钥匙针孔照相机手机定期笔电表控制器信用卡设备手机窃听器骇客手机
good	的第二问就是已知求概率为了保证设备正常工作
normal	播放不断的广播一个隐藏着的最高领袖的声音一个家庭
good	评估居导实施科学的业绩考核掌握合乎财务栽虻墓芾砭霾叻椒与老板的思维同步通过分析关键业绩指标
good	把水往蚂蚁洞里灌。我有时一个下午就干这种事情
normal	关键被安装后门或被蠕虫感染的计算机列表个如果两是都疑似好就博士啦哈哈认识了一个女孩
normal	因为天富投资把握非常专业地需要当天影响目标个股的各种因素尤其是消息面盘面有是否板块异动
normal	其它国税地税等衡量对外优惠普通发票或合作。另有最新电脑版运输发票代开还可以根据数目的大小来代开优惠的多少。本承诺郑重公司所用均可票据上网查询或到税务局抵扣验证。此信息长期有效
normal	需要都客户通过邮件的形式将在的详细联系信息填写清楚发送到邮箱详细信息内容包括您您万网的客户号
good	显然是你对你们的感情没信心。或者他希望是朝夕相处的感情事业比感情可靠不过你选择哪个看你觉得哪个更重要了来这里实在是心里很难受了
good	只是你别再来找我了。我曾经将我的全部托付于你
normal	这是生意兴隆一封善意的邮件。如果对您造成不便
normal	管理商品陈列沟通环境门店管理构成门店卖相管理的两大支柱六连锁门店间的是管理连锁门店间有效沟通是门店间相互学习互相促进的科学手段
normal	就是原因片子表现一直没有生活他在武庄的是里什么样
bad	成为那个素质有的成功人我的网站商务网绝对个好消息最好的是
bad	我也明星不过原来。所港台你不不知道的知道三级片出身的演
good	一直也觉得她挺喜欢我的。那以后我虽然跟不少女生有过接触
good	可上网查证或我司直接与贵司去税务局抵扣核对。彼此合作一次
normal	可在电脑网上查证或确认后再付款。以真诚的服务合作一次
good	落实详情请登陆查看。展览联系诺亚教育咨询有限公司电话传真网址地址上海市宝山区锦秋路弄区号联系人刘老师
bad	合作伙伴能先我们较多因成为之处你如果这封电子邮件认为你的对邮箱带来不便有的话这里我是这里对不起那声说希望你的谅解希望委托亿虎群发大师代发的我公司在在海关进项在
good	尊敬的新老顾客您们好深圳市中泰实业有限公司本公司国内设有多家公司现有发票可优惠对外代开普通发票含商品销售广告运输建筑安装租凭等增值税发票。点数较低还可以根据所开数量额度的大小来商讨更优惠的点数可为贵公司节省运作成本。此信息长期有效如须进一步洽商联系电话邮箱联系人林国梁顺祝商祺深圳市中泰实业有限公司
good	领导全球电子设计技术发展。在上海先后建立了高速系统技术中心和企业服务中心
good	广州市家圆贸易有限公司尊敬财务负责人你好首先感谢您们对本公司的支持和厚爱。现公司要多佘的正规发票代开点数低廉信誉第一欢迎贵公司来电咨询代开范围要以下商品销售运输服务咨询广告建筑租赁业海关交款书电脑和手写等发票联系人李先生联系电话本公司承诺先验票后付款本公司软件设置定时发送本邮件如有打扰深表歉意顺祝商祺
bad	使用家庭宾馆医院及餐厅等客户数额。产品销售价格零售价元个元幼虫含型及型批发价元个批发对一箱以上个箱型适用适用于成虫型适用于捕杀捕杀。北京市区送货上门免费日本用同时外埠鞠欢佑诚邀幸庹年月公司公司销售热线北京方阳工贸公司咨询呒
bad	我大门英国人发现技术是科学用怎样了中国的打开
good	提供访客的详细信息可以主动邀请客户开始对话客服人员之间可以实现内部对话软件设计过程中一直充分考虑接待人员接待效率让每个客服人员能同时接待的人数实现最大化提供强大的自定义快捷回复列表可自由设置各级分类索引快捷方式快捷键内置编辑模块可自由快捷的发送各种内容包括文本段落颜色图片声音视频等动态内容支持同时多个接待人员同时在线接待人员之间可自由转接对话客服人员可将网站访问客户需要的网页或图片直接投递到面前
bad	她甘心不说没什么。就这样结果然后谈出没有。第二一天没联系天
good	有着良好的社会关系。因进项较多现完成不了每月销售额度。每月有一部分增值税电脑发票海关缴款书等左右和普通商品销售税发票商品销售其它服务广告交通运输建筑工程
normal	就是拖垮也精力了。原因这个挺烦的其实现在黑那么医院即使有使很多药费也是报销不了的呢病得睡不着觉希望不大的冒险就别事情了现在我们都还在读研反对父母亲我们来往最直接的也是父母因为无现在既为难钱也没相貌一个农村来的穷小子是均是是虽然农民农村的但是家庭环境比较好父母是普通机关我现在很工作人员我也很为难小二之难说以为主医保好多少城里的那些所谓的医保也就医保公务员和事业单位有能力了企业的谁你你啊也鸟的
bad	度没法好那个把握。要情色电影人比如吸引的
good	本公司在全国各地设有分公司广州东莞等市有分公司。因全国各分公司进项较多现完成不了每月销售额度
bad	问题用来讨论。房间大部分老师可是这样一个说
good	一定被欺负死老爸就决定砸锅卖铁也让我上高中对这里面的父亲我也能理解他
good	也同样会为我们自己提高收入。所以我推荐大家还是多多点击。问题我的广告条无法显示小人或者广告条透明怎么办答第一次执行时会下载其他四个辅助文件。因为较大
good	注册就能得国内公认最好的博客系统开通免费申请
normal	同样会改的不信就我未来年房子还想现在一样每年上爬所以诅咒万恶的医疗改革改的看不起都大家病了零零有点悲观了吧贷款可以买房子医保还有商业保险呢如果要考虑住房就算要好在一起一个月剩余万块也两个人多年才买得起房子花钱少要癌症一些
bad	神话而且还的厉害非常。中以至于后来的打斗场面在
normal	发送到你的退回由于以下原因被邮件邮箱满容量如果有对此您疑问请联系网易公司客服部门全国唯一小时客户服务
bad	为订制企业客户同时培训上门服务热忱欢突鹘吕峡有缗笥牙春裳缋吹课程更多培训了解
normal	而是在原价格基础上开发出新的更好的产品来把更多的消费者吸引到的价格战虽然在中国市场上是门下最常见也是最有效的方式
normal	是每一个建成网站以后必须要做的一个关键性推广
bad	蛉悍远群发可各类赠送提供邮箱搜索软件信息切割软件邮箱发布软件邮箱过酥馗慈砑锹妓阉饕嫒砑凶嵛募允俏锍软件各类软件的详细图解说明
good	当然能容纳下这么多的垃圾了。所以我对也没有好感。火山小规模爆发第一篇投中了会议之后
bad	学员相互模拟对抗在乐趣中决策体验与经营企业的激发
good	食宿费用自理。食宿费说明南郊宾馆两天食宿元人
good	就可以建设您的网上家园。注意我司空间均可以免费试用天
bad	内部诚信度部落在因此很高的具有。联趣部落功能目前了部落相册部落论坛部落活动等提供
bad	进项为要冲减发票每月一部分多余有代开向外或合作
normal	一场知道您的一生不电影要用去多少个元需要只你投资元
bad	致贵公司代表我您好康达实业深圳有限公司的财务兼业务是。公司内部发票长期额外的有。书增值税发票普通发票广告运输服务行业如海关缴款还有。进帐完全可以或扣额抵相抵。本公司承诺重
good	好的又把小孩嘴喂刁了珀珀奶粉刚生的送过了。。哎。。当时没经验啊。。也不懂牌子。。售货员推荐啥就买啥了这次就看看纸尿裤
good	不是应该麻木很多时候是因为祥林嫂的感觉善待自己很重要可能真的说得多了
normal	还是没儿成熟啊。认为把养老人他就是吃饭之类的考虑没有考虑到以后住房
good	请联系联系人刘兴达联系电话承诺发票一律通过正规手续从税务局办理领购
good	以名胜古迹最为突出。世界历史遗产一宫两陵沈阳故宫皇东陵北陵辉山风景区辽宁广播电视塔怪坡九一八风疲本乓话恕笆卤洳锕荨攀纤中街商业步行街浑河乐园夏宫新民西湖新乐遗址沈阳植物园运河风景区环城运河水系康平卧龙湖沈阳古陨石被评为沈阳十五大旅游景观。年月
bad	理念全新的掌握及技巧。匡老师特有的热情和引导能力以及问题强烈解决的使命感
bad	退订将要的发送发到作为邮箱发送至直接我们将不会邮箱下次您的邮箱
bad	注册就成功了。赌博等到什么参加的信用卡才需要
bad	初步学会心态正确的认识重要性服务深刻客户服务的树立
normal	如须进一步洽商详情请电小时业务热线联系人赵铭顺祝商祺优惠代开发票
normal	接受不我们这类客户的订购。你们网上团购品牌的是标准选择什么我们网上的团购具有全部商品较高的品牌知名度
good	才能真正适应企业信息化发展的需要。如何培养专业的复合型管理人才
bad	如有打搅深表歉意一个想象超乎的强势组合一场商业智慧的激情奉献中国企业面临的实际问题脱颖而出什么职业经理人们关注最的问题是什么您是希望同事在中
good	至少我们也会有一段真挚的故事值得我们以后回忆基本上
normal	了解您减少的原因吗尽在北美贸易情报北美进口动态数据库北美进口贸易动态数据库一
good	我一定不要成为天平座从没有过过有情人的情人节跟她交往了年多
good	不能接受没必要说让孩子辍学就是害孩子拿个高中毕业证又能有什么啊苹果牛读的太多了可能对赚钱而言投入产出比就降低了但是读个大学本科我觉得还是必要的人一辈子不能光挣了钱了还是得有点自身内在的东西嗯
bad	碾你的从身上过。。。。这下世界注意了清静
good	听说今夏票房惨白不知何故。尽管本片略现粗糙
normal	所有的串联子表到个人电脑上的即接口所谓的串口
normal	可以上网查证真伪或直接去税务局验证。本郑重公司所用是绝对承诺真票此信息长期有效
good	超级管理漏斗的持续提升店面管理水平收获很大。深圳市城市俪人有限公司运营总监刘晓伟很好对实际工作有很强的指导意义
bad	你的反应什么是呢当时我梦辩护我的清华为反正了一番作
bad	占用网络资源避免被拥堵而造成。证据有力最为的提供
good	都有不足之处。我还检查到妈妈传递给我的一些有色眼镜。我开始学会用自己新的方式对待他人
good	了解并会用柯西中值定理理解函数的极值概念
good	终于体会到语言的局限性了。这种事情你父母和你瞎参和啥呀弄不好又是一件家庭惨案毕竟成年人应该自己做决定
normal	如须进一步洽商联系方式详情请电邮箱联系人李世华业务顺祝商祺
normal	说高兴地他们柳州市第四人民医院糖尿病救专科了我们广西柳州市第四人民医院糖尿病专科创新疗法三位一体绿色降糖疗法广西柳州市第四人民医院糖尿病专科三位一体绿色降糖疗法
bad	正在我们建站代理网络科技有限公司专现在招聘
bad	多谢不这知道会哪个部门是的了解的大侠有能不能一下介绍了
normal	由中华人民共和国劳动和社会保障部职业技能鉴定中心颁发国家职业资格等级证书
normal	消费了解以及朋友关系等来习惯当前成都合肥网友的生活状态。因此
normal	大为感叹现在中华文化的迷茫浮躁和根基缺失
normal	按照首都经济贸易大学研究生部的规定收取约元。七如需要试听
good	中国企业网通为您提供优质清晰的网络电话服务
good	中信国际电子科技有限公司推出新产品升职步步高做生意发大财连找情人都用的上
good	更要有非常专业的统筹计划实施生产协调沟通以及高强的跟催等能力。随着商品市场的多样化小批量化以及节奏的加快
bad	血缘关系它和狼虽然近很的有着和许多相似的特征
good	你才加入吗那个时候一切都晚了有多年历史的瑞草堂各种保健品分别具有有减少皱纹补肾强身乌发养颜活血通经祛瘀止痛提神醒脑益智捷思补锌补铁改善熬夜解除打呼噜消暑解暑调理肠胃改善食欲清热解毒凉血祛邪疏肝理气调理三高疏通心脑血管等奇特功效。如果这封善意邮件打扰了您
good	企业管理专业硕士研究生。负责构建了青啤竞争情报系统战略管理体系及其日常运营
good	对您造成的不便我们表示歉意网度邮件监控聊天监控上网监控网度是一款功能强大的网络监控软件
bad	心里什么想不说也出来。相处了日子已经一段有了
bad	压力他们斤斤计较面对愿望保护自我的内心进行。抵抗的方式一是推卸责任二是阳奉阴违三是跳槽四是弄虚作假五是消极怠工六是假公济私七是是你争我夺。工作中过度的压力损失会员工个人和企业使都巨大的蒙受。所以
good	终身可用您好投资百元轻松创业你我有缘期待您的到来利用网络创收八十年代初
bad	培训贯穿中的财务知识很实际对帮助工作有。无锡华信安全设备有限公司钱先生讲师毕业郭老师介绍学院法国巴黎第一大学工商管理于
bad	较多了社会各界人士的得到认同本公司进项因
normal	不重复元赠送按邮局服务器分类邮址大全万家中国上网企业名录大全中国多款整理群发邮件搜索邮件邮件商务信息发布消息群发等推广您现在需要只软件元就可以享受所有服务和产品
bad	通过是和客户关系有价值最策略的一种商业选择。管理客户关系管理
normal	但很可能是要远远好于不是现在的情况。如果您您企业主或者商人
good	已经有人告诉我。真是让人啼笑皆非。学校没有能力评价学生的水平
normal	也非常独立。有时独立的让人觉得都不需要我了。我们一般见两周一次
good	其人员和环境和清华的差不多我真搞不懂啊。清华的声望和条件
normal	定制专门为团体我们体恤短袖衫以及其它团体服装。印我工作室向您承诺绝对优惠的便捷价格的服务上门拢速递样品免费送货限北京地区高品质的服装个性化设计在我们的兄设计黄鹕耐颇钕胍杓及浮现在
normal	有是多种在广交会上采购的。此次接受事先就我们了一些供应商的网上预约
good	贵公司负责人经理财务您好我是深圳市华雄实业有限公司。我司实力雄厚
bad	学员讲师共同与模型同时问题解决的分享与工具
bad	速度和集成度的提高正是了它们自身发展的障埃核俣群臀贾律拢碌贾滤俣冉档汀革命这一悖论成了数据中心微环境思路设计制冷的引发。这一悖论说明
bad	您精心奉献给。肌肤必需真正的有效用及正确的方法成分护理
good	缓笱杆俜缑胰蚓济发达地区。年美国在家办公一族为万
good	找回来又能如何你让她如何再去面对那两个冷酷的家庭可是那时我太自私我忘了其实我自己就可以养活她因为她已经出嫁
normal	根据看到我的一些例子可以得出标题可能不太完全的结论北京人很实际全篇一个关于结婚问题的欢迎灌水出现没有一个一个爱或感情及相关字眼分吧一对男女恋爱年
good	健康美丽财富和自由的大门将向你敞开你最大的资本就是你的业余时间机会
good	对人们的生活产生好处。这就是研究。完全用工作与的推广这么说来我还是对清华有些好感。遇到一个好老师让我从呆头呆脑的技术工人的状态恢复过来
normal	需要三个月后才能解决琐碎的事情号上海。是月去去的上海
good	谢谢深圳市好利通公司合作部梁晶网址电话另人才网免费提供人才求职欢迎企业招聘
bad	她很不你交往也不是直爽我和女友直爽两年了
normal	工程建筑票等注我承诺郑重司所有票据税务局代开或企业直接开出先验票后付款联系人李先生业务电话广东中联实业发展有限公司
normal	漪涟碧波一推向浪一浪在这风和日丽动人心弦的美好时刻
good	多面手。仅上海的在家办公一族就有万。在北京
good	还对逃课的同学表示同情。还问我们在座的有没有其他课特别紧张的
good	我看到了黎明的眼睛品读杜浪左面冷眼右面欢颜里的美丽运动推荐网友推荐部落晴天还是阴天栀子花开杭州主流部落关于公司服务条款隐私保护招贤纳士北京友联无限科技有限公司版权所有京证号年月日周刊第期登录提示登录密码活动时间年月日星期六中秋节前夜活动地点北京长河昆玉河活动费用人包括中华世纪坛颐和园往返船票
bad	环亚汇市交易须知实习帐户问题帐户常见开设留言簿开户我们绝无仅有的即大奉送关于得美金自即日起止日至月
normal	为解决参展商展位的公司凭借我从事多年供求广交会业务方面的经验及良好的信誉
normal	但不像别的恋人那样。因为不在我们一起。前几天去又我看他因公
bad	心情不爽也。不在华为反正能钱得到很难说。挣有的人挣挣
normal	采购时需要正式报销票据。我提供长期为贵司司如下票务项目先用票后付款电脑版增值税专用发票
normal	需要将会人们为自己规划一套包含各种不同收入来源的收入组合不仅只一两种而已而是由许多不同且分散种类的收入来源所组成的收入组合。如此
bad	随机客服可以特价促销品易购网电话小时电话购买
normal	以节省大批的线路租用费用。并且当携带客户笔记本电脑在外地出差的时候
normal	向前走恩我去世和我的外公都外公这样在床躺了两年死的说实话是能脑溢血了的都是福气
normal	贵作出是否公司了参展的计划由于馆内有限摊位
good	尊敬的贵公司财务经理负责人您好我是深圳海涛实业有限公司广州。东莞等省市有分公司。我司有良好的社会关系和实力
bad	这个定理身上正确我的在至少是的。牡丹园自转
bad	您好感谢您在百忙之中花时间抽出此信此您发表示歉意首先信函地对给此信函冒昧只要能您能但是一点时间阅读阅读
bad	最新窃听子公司透视设备万事通国际电子科技监视迪克伟业国际集团隶属。专业经营最新高科技电子产品业务
bad	却我清楚女孩儿很她但我想要这辈子的那种就是
good	会求多元隐函数的偏导数。了解空间曲线的切线和法平面及曲面的切平面和法线的概念
bad	这样的苦恼又被了倾诉倾诉。很奇怪的是可是
bad	美丽它那么还是的吗我努力尝试很地曾经着诞生美好的回忆让
bad	后感受到大悲过经历痛大的李洋此时此刻的惊喜但知道不新闻这条看到可以
good	建筑其它服务行业都可以代理代办。我公司因全年为外商代理进出口业务
normal	一团一议人三星四天双飞去晚纯玩团年月晚回天天云南丽江泸沽湖香格里拉双飞元人平日周四元海南周五元人海南四天三晚四星出团天天出团元人平日周四元人周五元人日元六天月日起元人云南昆明大理丽江双飞六天品质团月日日元人云南昆明大理丽江双飞六天特价团月日元人成都九寨沟黄龙四飞五天游包团
good	都不及网络信息发布那样成本低廉有效。详细信息请查看网址现代企业的成功必须依靠过硬的质量和强大的广告支持。本软件就开辟了一条网上免费发布大量信息的捷径。只需启动本软件
normal	正常感情很产生。可是救出要把绿珠从风火连城那里他来
bad	社会关系良好的有着。贵公司做帐在或抵扣需用进存销和方面发票到的话
good	很悲哀。真没见过这样的人我是脾气很好的女孩
good	可能生产的时候会有些问题把。父亲还说以后孩子要是随我还行
good	性感的屁股插进又滑又嫩嫩的阴道夹着粗大的滑爽滑爽的赶快去操网放心
bad	一起和分享我们乐趣中国每一瞬间经济迅猛发展的见证。您诚挚的
normal	就是这是的磨炼指望从来不她人生人生好过的
bad	都今后的公司对作用运作大很的实际指导有。非常感谢经理人平台这个搭建
good	可问题出在你当初没有做现在是网络经济时代
normal	决定彻底将与她一起的所有格式化记忆。干得好不过还要从心里放手
normal	最大地创造了经济效益投资它小见效快零风险高回报。高楼小采用吊机伏单相电源
bad	这种过瘾的打斗片断并不多。这问题一个度的是
bad	探索就可以大量的引发和实验。这特点我在那个年代的就是。也妈妈逼着虽然我书法练习
good	猫猫不喜欢这样的男生唉还是依旧让他留在我的记忆中
bad	都休息每次她打扰。赔偿还是请求法院万元后请我把父母几次去在
normal	而且没有广告条钱就花花得来注册除了地址冲浪赚钱外
bad	日本却在品牌但日本女性的第一护肤成为。大家侵略性都日本民族的特征明白很有的
normal	发票种类如下商品统一销售电脑版运输服务业广告建筑工程租赁专用等大小。以上各类发票可以根据贵公司数量衡量来发票优惠的点数。更希望有机会与贵司合作贵公司在发票的真伪方面有任何疑虑或担心
normal	作为暴露问题的指针车间工厂的基础如何是和目视管理为什么运用管理管理合理化的根本的板与实质精益目视管理信息发布核心信息板信息板卡片创建和应用不同类型的进度视觉工具的效用案例研讨车间控制与过程控制生产作业计划的追踪实施如何控制最佳的生产节拍
normal	在操作实盘股票方面位居国内一流行列。天富有别于完全投资绝大多数以为主股评的投资咨询花费绝大多数投资咨询公司公司巨资借助媒体的公信力以做股评的形式夸大其词做广告
normal	这个责任义务可以随时推卸掉。对这样感觉来说很不公平。其实偶不赞成同居。呵呵至少有房子才能结婚啊
good	这样你便拥有滚滚不断的财源。工资待遇元以上月。业绩累积收入直线上升做得好年薪可达万元以上。友情提示这是一套科学而现实的网上赚钱方案足以使你在几年内成为派头十足的百万富翁。不经意之间你得到了这么一个创业良机你会庆幸自己如此幸运当然如果你一时还不太明白请看常见问题和运作原理
bad	关注业内人士深受。此举问题被认为部分民营企业意味着开始诚信正视。创尔特是中期世纪年代在开始创尔特热水器燃气成惟一名牌中国新增我看到的广告最多的牌子是
good	是一次人才引进和投资洽谈的良好时机。具体内容见附件。详情请见中国工程技术人才网西北人才网中国国家人才网中国青海人才网年中国西部全国人才智力交流大会组委会二五年七月二十八日
good	因此建议可以将是否有高潜能毕业生发展计划作为挑选企业的首要考虑因素。遗憾的是
good	华红兵与汇源果肿懿弥煨吕褚黄鹧菀锪艘桓鱿执窕埃够阍果执右桓霰本厍钠放朴靡荒晔奔湔粗泄康谝弧策划天士力集团现代白酒。在上市公司天士力集团发展大健康产业的时候
