bad	企业又作用对管理能长期的影响产生。余是老师我们企业倍受欢迎的老师。我司组织第一批家供应商的总经理董事长培训了贵司组织的参加
bad	用得着么除了之外少数学校的研究生名额紧张现在都不少学校一个专业人这样几十上百人呢要多这么找认领来内定真不容易还据说可能有的学校招生简章公布上面的招生数字是是含水分的请注意我说的清华大学不是
good	因此我司可以长期为广大客户代开多个地方的发票
good	科技信息杂志征集论文的通知我编辑部有国家一级杂志及省一级刊物
bad	贵公司财务经理代开鑫海涛商贸有限公司全国各大中城市您好均分公司公司有互惠互利的原则合理对外本着发票代开范围商品销售广告电脑版运输发票其它服务租赁建筑安装餐饮定额发票等税率左右代开。贵公司需用做帐或进存销在方面如到的话
normal	中国价值工程拢谢崂硎手耙蹬认证会嘌凳职业从事曾在科学院研究所复星高科美国公司等高科技企业研发机构培训师开发和工艺产品十余年
bad	贵公司负责人经理财务您好深圳市华达实业有限公司。全国各地市分公司广州东莞等设有有都
bad	全面更形象的能公司企业的整体展现。快速的关注盛企网的企业会员吸引及参与。商务通马上展会信息以上所有只需年发布服务什么商务通是中国企网盛高级会员是
good	我一定不要成为天平座取个轻松的昵称三年多来
good	同学们可以多加留意。还要了解一个企业是否健康在事业之初
good	就能够支持额外的用户。而有了成功岛托机卡套件
good	钱麦当劳我说过了我从小喜欢吃土豆所以吃的根土豆一样你见过苗条的土豆那也不是不能生阿如果骨盆小于胎儿的头盖骨
bad	普通发票深圳广州东莞上海浙江等内地票开均有向外代或合作
good	并努力开创电子商务的中国模式。秉承年互联网专业服务经验
bad	装修不少男人不过过一天没有就好自动了好几个月认为能了逛街
good	但恋爱已经谈得过气了这是我认识的一个姐姐的故事
bad	对封装技术以及无铅元器件元器件的工艺要求
normal	可上网查证或我去直接与贵司司税务局抵扣核对。此信息长期有效
bad	贵公司负责人经理财务您好深圳市伟达实业有限公司
good	得了一个最佳论文奖。然后就有一篇校内新闻宣传我校王垠同学获得会议最佳论文奖。这是大陆学者首次在如此高级别的会议上获得如此高的奖项。这个高级别的会议
normal	因每月进项多出项少现有一部分优惠可发票对外代开税点较低
good	太多的无奈。。。。。。希望能找个听我倾诉的希望你能善良
normal	增值开运输电脑发票开来自我们所有发票都保证税务局
good	全套价格人民币元。售后承诺一周内包退三个月内包换
bad	交流新给心理员工。市场人员培训个月专业脱产是
normal	在操作实盘股票方面位居国内一流行列。天富有别于完全投资绝大多数以为主股评的投资咨询花费绝大多数投资咨询公司公司巨资借助媒体的公信力以做股评的形式夸大其词做广告
good	个月前因为种种原因分手了虽然劝自己不要再想她了
good	如果您还有继续了解的兴趣请到我的这个个人主页上去看看致礼建站代理
bad	贵公司负责人经理财务分公司我您好深圳市华源盛实业有限公司的广州东莞等市是有。我司实力雄厚
good	先生小姐您好很高兴认识您。我司有意与您合作可长久给您带来巨大的效益另因合作项目的高度自动化
good	有了可能我的执著就是心里只有她一个可能在她的生命中我不再是那个与众不同的人
normal	清华大学兼职研究员电子信息科学技术蕖粽郊缭绞笨炸冯正和
normal	以后再说吧卖片己没有关系刷卡可以我们如果没有卡还支持手机付费还可以按揭银行
normal	每月有一部分增值税电脑代开或海关缴款书以左右及普通国税地税向外发票或合作
normal	主演钱嘉乐林正英。是的讲砸毁黄飞鸿洋人烟馆
normal	但是这些股票还是一直的高再创创新新高倡导已经在去年年初年和讯公司以投资的理念选股
normal	发展更多下级代理或让客户从你的网站上购买更多的商品
good	我司认真负责诚守信用郑重承诺所有票据可税局核对或网上验证还可以根据贵司开票量的大小再优惠多少此信息长期有效如须进一步洽谈联系人童华文电话邮箱
bad	时尚前沿无限创意星新搭配主义淑女火闻人鱼小姐聚焦了张瑞希张瑞希个人档案张瑞希发展中国想来痛巩俐张艺谋生命中所承受不能之喜欢感人鱼小姐看第一次尴尬最的第一次约会情感故事不沿自白我你的天使私人医生痒女人私处的尴尬九种类型阴道炎的用药之道男生做一个大学男生的痛苦解密我会同性恋怎么是无限创意搭配新淑女主义导语淑女
bad	方式管理者与被管理者是对互动的常见进行。压力管理者来自的压力
normal	试试您就知道了。而且现在只要注册就有机会赢取大奖苹果。期待您的评价现在的过去博客的免费空间
good	尊敬的商家朋友您好我是深圳市裕华实业有限公司的。我司实力雄厚
good	卧铺元人第一天深圳德天第二天通灵大峡谷沙屯瀑布第三天德天瀑布越南的板约瀑布中越号界碑第四天北海银滩涠洲岛第五天早上到达深圳详细行程介绍晚上在森林公园内瑶族传统吊脚楼下面沐浴着银色的月光
bad	大小还来所额度数量做的根据点数可以优惠的商讨。公司成立多年中心一直坚持以诚信中立足于商场为
normal	欢迎信誉第一来电来人洽谈。联系人李生咨询电话祝传真商祺
good	关于中国河北青少年家庭教育及健康产业博览会简介为了贯彻中共中央国务院关于进一步加强和改进未成年人思想道德建设的若干意见精神
good	是因为他自己对你们之间的那份感情都没把握如果他说你是他一生最深的唯一的爱
normal	以及清华大学首届国际博士生论坛无线通信分论坛主席。
bad	商讨较低。大小还来所额度数量做的根据点数可以优惠的点数。方面贵司疑虑发票的真伪在如任何有或担心
good	觉得他人不错。他却也没有什么异常表现。然后活动结束
normal	今天居然因为一点小大吵在手机短信里和我事情了一次
good	影片最初拍摄的时候把梁家辉搞成断了左臂估计是想当然的认为右撇子演员挥刀砍杀
normal	有因为过去他过失败的感情经历所以现在决定单身一段时间
normal	担任对外经贸部专业进出口公司外销经理先后国家过多间外国公司驻北京办事处首席代表及中外合资企业总经理等职务。长期的工作中积累了丰富的工业企业及外贸企业管理经验
normal	本文介绍黑体了嵌入式系统中技术的发展及应用六号字
normal	除非想她和别人。可静怎么办呢向她提出离婚静什么也没有做错
good	可按照以下格式填写报名回执复制有效我们收到报名回执后会在开课前五天传真详细参会确认函及路线图报名回执参会单位名称参会人数人联系人电话传真参会费用元参会人姓名付款方式现金支票转帐请选择打
good	但是我绝对不会因为有人追我而离开他的。只是觉得这样良心上过不去。追我的那个很优秀
normal	太让我失望了天道酬勤陈靖醉中醒戎装盐搬个凳子
normal	先生您好小姐很高兴认识您。我带来有意与您们司可长久给您们合作巨大的效益另因合作项目的高度自动化
bad	你免费购买都会全部的套需要公司模板咨询单独超级音乐系列得到以及咨询人民币元的套咨询公司咨询模板
good	显示自己的下线数目。提示注意广告条左角的小人在走动时
bad	没她孤男寡女如果你告诉而且是的话我受不了啦
normal	我的祖辈们一定恩泽于我了。说道考虑可要你清楚
bad	价值元无线路由器参加前名问卷调查者一台可得按摩器一台了解您如果信息的其他相关想
bad	清扫初期设备挑战沟通零故障自主困难源技巧保养对策的七步骤车间人员讨论新型的上下级与意识自我关系培养指导的培养激励有效的氛围与辅导下属如何如何学习持续与改善的现场塑造如何有效的上级之间向与汇报同级部门向沟通与反馈的处理人际技巧与关系与下属下属的技巧与方法案例黑带导师简介王先生管理工程硕士高级炯檬管理
normal	探讨我省信息化人才建设工作的思路方向和步骤
normal	过于片面的估计一个人。有也许都人两面性吧。再理性的人也有感性的一面
good	我一定不要成为天平座山与泽平第一个没有情人的情人节大哥您从娘肚子里出来就有情人除了那所谓的爱情难道心里就没别的么跟她交往了年多
good	山东省信息化工作领导小组办公室鲁信办字号关于召开山东省首席信息官大会的通知各市信息化主管部门
good	看了这个才安下心哈哈奔流感情你也是信件好心人之一吓我一大跳
bad	评判以中很混乱复杂在容易了陷入。这行政化直接了即录取的导致招生招生标准不再单纯的教育标准
good	你发送到的邮件由于以下原因被退回邮箱容量满如果您对此有疑问请联系网易公司客服部门全国唯一小时客户服务
normal	默契和幸福。可是由于种种原因原因就不说了
normal	难道就凭每月元的收入可以实现这样的工作做要你吗话说回来
normal	每月有余额等。对外联系些业务贵是在平时作帐及销售方面公司需要用些票据可在我公司代开。如商品销售地税建筑安装其它服务运输广告发票发票左右收费还可代办海关缴款书。在我公司成立多年一直坚持以信用
good	请及时联系我们以便给您取消注意凡在我公司购买机票面值超过元赠送元抵用卷有效期月日至日详情请致电国内专线国际专线多线国内传真国际传真联系人兰小姐王先生
bad	机构产品背后的策划内幕精彩回放著名营销策划经典之作的畅销
normal	占地万多平方米。是授权美国康明斯发动机有限公司
bad	业务香港同行业之为。本公司专业龙头企业最新高科技电子产品经营
bad	又人家远道而来熟人毕竟其他没。为难中看了感慨好啊。就我同班同学曾经那个你喜欢的相当于
normal	是及克罗思氏病。溃疡性结肠炎直肠炎一种慢性消化道疾病。常见有症状腹痛腹泻便血等
good	并在实践中总结出具有中国特色的连锁经营理论。是香港新世界集团中国区大型电子商务交互平台电子社区服务中心连锁体系设计搭建拓展团队的高级管理成员。马老师已在汕头深圳成都顺德昆明重庆南京合肥等地先后成功开办过数十期连锁经营公开课程
normal	帮由我们一切你搞定。建设网站业务联系电话
normal	就有些蠢蠢欲动人的她离女方父母远远的支持私奔你就应该怎么怎么样
bad	顺手衣服就了几件自己的拎洗一起了。衣服很多
bad	不在也不会他一起想。生活很他的地方认真努力的欣赏
bad	大哲学家的名言。上课时老师停会下来很多问题次学生让提
good	几年经历了这么多哎男人先以事业为主吧你以后还不知道怎么生活呢
normal	就是的不最幸福和喜欢的人生活么认识开心的第一个圣诞节和改成生日一天送他了一个胸针还有一个雪人的我我把那个雪人挂件挂件项链坠戴在脖子上了虽然有点扎嘻嘻虽然相对于胸针是附属品可是那时候我们都很我们不过
good	每月有一部分增值税电脑发票或海关缴款书以左右及普通国税地税向外代开或合作
bad	拓万里鹏程强力推荐自助建站全部国际域名网站空间企业邮箱搞定元年重要最的内容打字会是如同就没有更新的建好小时那么换衣服简单就能大多数对建站技能欠缺的对于和个人来说少量投资就能网站企业开通的网站全球你你的企业让还网站吗时你的竞争对手商务正在电子利用渠道销售拓展及成本降低当
bad	基础一定美工有的人一起与网站我这个搭建中可以此网站在放进自己交流和网友喜欢的各种东西我编程可以负责有限本人水平当然
good	税率方面较低左右的税点。其它国税地税电脑运输等普通发票左右的税点优惠代开或合作。还可以根据数目的大小来衡量优惠的多少。本公司郑重承诺所用票据均可上网查询或到税务局抵扣验证。彼此合作一次
bad	上财务报告各部门与财务人员沟通统一的平台在读懂有效达成建立起清晰的成本控制意识流意识现金强化
bad	单身每一个长得还算看见能人吸引再一眼的看
normal	经理财务你们好我是公司深圳市讯通实业有限公司
good	网上订货直达您家。诚招各地经销商。与您共同打造全国最大的仿真工艺品网站。您可在百度搜索引擎
normal	助您实现突破赢利时间月日费用北京含地点课程资料电话等联系课件胡传真小姐十倍速提升企业利润突破力月日北京中国很多企业的不是死亡在业务上赚不到钱
bad	百度在本月于正式美国纳斯达克股票市场挂牌日上市
good	品质保证让您可以放心选购。祺福珠宝公司的提供无风险天试戴不满意即可退货。招聘专兼职珠宝网络销售员珠宝网络代理商应聘要求对珠宝具有基本常识或对珠宝知识有强烈的学习欲望办公场所或家庭具备上网条件
normal	是企业着的不仅面临巨大而激烈的产品服务竞争
normal	人民币做充值世界广告。中国授权总代注册商现设立中国区代理生效正式上海银狐动力开通如百度一样的后台帐户
good	并且开始用它设计用来研究计算几何的一个函数库。另外还找了一些希奇古怪的程序来玩
normal	却用差的现在好一点的药水一瓶就是几百万块说实话几不算真的块多的一次花那么多的估计也快挂了吧。不过长期而言
good	用户一看就会。局域网版增加功能局域网共享收发用户可在同一局域网中任一台电脑上直接发送或接收传真。自动分发服务器将收到的传真根据用户的传真号码邮箱和其它信息自动分发到用户机上。自动转发到信箱系统对所有收进来的传真自动分发的同时
normal	就为了一瓶酱油去和人家大排长龙结帐。接着
good	降低了工作效率和质量查看演示解决的问题业务过程查询不方便业务员每天要面对多个不同的客户
bad	了如指掌保准你让对自己。男女适用均你服装最喜欢哪种颜色的穿咖啡色你的性心理黑色蓝色绿色灰色白色了解男性你如果一位美妙绝伦的女子或一位风流潇洒的遇到
normal	本来以为大半夜的跑来自己一个叫要结果妞知道有也怒不我上问版来这个这个合问题不合适。我我一个很好的异性朋友
good	并提供统计分析。支持简体中文繁体中文英文日文。任何国家和地区的对话请求都不会出现因语言差异而产生的乱码现象。开发商网址免费试用地址我的联系方式是电话李世刚更多软件产品请登陆盛邦网站
bad	做饭爸妈有时她姐姐还不在我这个给能。爸妈不太会人关心
normal	代理提供制作招聘启事张设计招聘工作人员餐饮现场名索引中企业名称招聘元及要求详细信息职位招聘位人民币发布免费在上发布个职位一个月期限
normal	联系方式如下联系人联系杨益明手机顺祝商祺
normal	可是绝大多数是经理无权决定下属的晋升加薪等方面的
good	本公司完全可以依照贵公司的需要来进行合作至于合作途径
normal	贵是负责人经理您好财务完成我们东莞市麦捷贸易有限公司本公司是一家集制造销售代理为一体的综合性公司现公司因进项较多公司不了每个月销售有每个月额度一部份增值税电脑版发票和普通商品销售发票国税地税货物运输等发票优惠代开或合作
good	能看出来这是心里话呵呵这样也挺好的我要是也是对感情看淡些就好了可惜天性如此估计改不了了这有点不公平哦尤其是俺一个大男人比女生还重感情面子上有点搁不下呵呵还得谢谢开导现在感觉好些了标题我这么想正常吗呵呵
good	发票种类如下商品统一销售电脑版运输服务业广告建筑工程租赁专用等发票。以上各类发票可以根据贵公司数量大小来衡量优惠的点数。更希望有机会与贵司合作贵公司在发票的真伪方面有任何疑虑或担心
normal	比较成熟得印出来想法给大家看。一有只要篇文章一些可取之处就不错了
good	多则需上千年才能成大材。且所有材料皆在热带密林深处
bad	爱上两个责任心几个人甚至没有和怜悯之心的男人倾慕可以因和性
good	也可以积攒幸福在刚刚搭建这个小屋的时候偷偷的给了自己一个小小的约定把不愉快的感情经历拒之门外一段时间过去了发现还是会不由自主的想在这个小房子里做一些倾诉也许正是因为她是完全属于自己的一个地方
normal	感觉到也不会您太大的影响。您的是财务状况稳定的
normal	但愿这帮助对贵公司有所函。我享有司国家优惠政策低于纳税率一般纳税人。本公司可为贵司代开如下票务项目
good	必城永久的朋友。祝生意兴隆欢迎来电咨询洽谈合作愉快联系人唐生手机
normal	夜间值班电话传真公司地址上海市福州路号室
bad	却典籍都连读过一边没有读通更不用什么说了眼光西方的拿文化来中国推演
bad	内希望与贵司。方面贵公司疑虑发票的真伪有效如任何有或上网担心可验证或贵公司税务局直接去抵扣验证。此信息在全国范围在彼此合作合作一次
bad	现有为减少本公司损失部分结余普通发票优惠可代开对外
good	或者在高级会议室里接待您的客户。租赁费当然是便宜的不可想象啦。电话
bad	尊敬的领导财务部你好我找开发票优惠价格最付款外代对以来收取联系公司名称深圳市振泰实业有限公司代开方法请先发票验证抵扣开具后费用电话请来电话广告同行如比优惠注商量绝对其它发票运输建筑安装需等我公司另公司会对口公司代开。联系人何先生电话谅解如有打扰敬请
bad	请给邮件于该清除。业务欢迎洽谈咨询。有效瑞兴达实业有限公司联系人张生业务经理业务手机电子邮件本信讯谢谢永久
bad	一个比尔盖茨叫做的人来软件您合作找衷敢夥畔履形鹑种怂档墓鳎冒险亿万富翁未来的成为吗现在机会如果类似的有出现
good	才分。天津大学第一志愿收满不要我。昔日的好学生
good	还有年半在一起的浪漫的记忆也许真的是失去了才懂得珍惜
bad	最后一代情结济世拯民之英雄怀有的梦想家他们早已娱乐或许了远离
good	现有增值税电脑发票和海关代征增值税专用缴款书对外提供
good	其它国税地税等普通发票对外优惠代开或合作。另有最新电脑版运输发票代开还可以根据数目的大小来衡量优惠的多少。本公司郑重承诺所用票据均可上网查询或到税务局抵扣验证。此信息长期有效
good	另外还有三对在此经过真的无语形容这赤裸裸的一幕
bad	实力雄厚社会关系一定的有着。多我公司每月进项在销项少
good	可按照以下格式填写报名回执复制有效我们收到报名回执后会在开课前五天传真详细参会确认函及路线图报关员专业技能提升训练专题讲座报名回执参会单位联系人电话传真参会学员参会学员移动电话参加人数人费用总计付款方式请选择打钩现金支票转帐
bad	成本通关节约。风险海关事务处理带来不当的意外防范
normal	适用于有时间看盘或炒股比较水平专业的资金量在万上的客户。若需要您调仓换股请先加入天富实战短信会员个月承诺我们将您手中的持股出货在一个相对高位
good	一定要优生优育可我觉得我相貌方面还算可以啊
bad	目的经理人而通过抓使能力点达到行为转变观念的改变。操作性管理技能能力动手是实战能力
bad	找都对他不一眼看看。他都会地方每天我上班的来我我
good	点中要穴实操部份主要由十余年的工作和多年顾问培训狙樗鄣陌咐鳎笠敌枰报名回执单此表格复印有效单位名称盖章企业性质培训联系人电话传真手机参加者姓名中英部门与职务手机参加者姓名中英部门与职务手机参加者姓名中英部门与职务手机工厂设备维修管理工程培训时间年月日上课地点侨鑫教育培训基地广州市天河路号主办单位柏明顿管理咨询有限公司报名热线咨询联络人包健先生培训费用元人两天含教材证书午餐等前言追求及时化生产的今天
normal	她付元须向你他你的发展一级代理一个代理二级代理
bad	贵公司财务经理代开深圳市佳威贸易有限公司全国各大中城市您好均分公司公司有互惠互利的原则合理对外本着发票代开范围商品销售广告电脑版运输发票其它服务租赁建筑安装餐饮定额发票等税率左右代开。贵公司需用做帐或进存销在方面如到的话
normal	打击你一下就是人家拿个漂亮瓶子骗你的钱的
normal	但是没有钱却是万万不能的。在金钱您的职业生涯中
normal	要求出以的角色决策我们进行怎样的来夺回丢失的市场份额
good	您好搜狐落户广东省中山市啦为庆祝新站点的成立现推出特优惠广告套餐并免费为您发布个人信息只要您一个电话一封其余的事情交给我们帮您处理详情请查阅网站或现在招聘业务精英只要你有一定的社会关系或客户群加入我们的团队信誉第一顾客至上我们将竭诚为您服务搜狐招商频道中山运营中心联系人叶小姐林先生联系电话小时服务电话传真
normal	不过当时没家里人家觉得觉得有什么什么关系哼哼
good	如须进一步洽商详情请电小时业务热线联系人赵铭顺祝商祺优惠代开发票
normal	天富推荐投资股票的时间和数量主要要考虑大盘板块提供所个股机会的大小而定
normal	同行我们主办承办清华大学就业中心清华大学学生职业发展协会清华大学职业发展协会宝洁俱乐部
normal	本依照完全可以公司贵公司的需要来进行合作至于合作途径
bad	商讨较低。大小还来所额度数量做的根据点数可以优惠的点数。公司成立多年中心一直坚持以诚信为牢固公司的核心思想形象作为公司树立郑重真正彼此贵司一次必成永久朋友本公司做到承诺所用票绝对真是机会更希望能够如合作与合作方面贵司疑虑发票的真伪在有任何有或担心
good	为什么要崩溃了最近和家人的矛盾激化了快一年了
bad	别于再来我只是找了。我将全部我的托付曾经你你
normal	也许早点认识就好了。说还他觉得热情太我了
normal	和新目标英语教材完全一一对应根据将网站各地学校课程进度
normal	点数较低。还可以根据所做数量额度的大小来商讨优惠的点数。本郑重公司所用是绝对承诺真票更希望能够贵司机会与有合作如贵司在发票的真伪方面有任何疑虑或担心
normal	承受比较能够遇到困难承受能力也在考验她父母的拉拉她是独生女
good	中国的工业重镇和历史文化名城。沈阳是东北地区最大的中心城市。地处东北亚炯萌突凡澈济圈的中心
normal	可按照以下格式填写报名回执复制有效回传到收到我们报名回执在后会开课前五天传真详细参会确认函及路线图公司名称培训联系电话人联系联系传真参加电子邮箱元参人数人费用总计移动电话会人所任职务移动电话参会人所任职务移动电话参会人所任职务移动电话参加课程如何获取有效外贸订单及国际贸易操作技巧月日深圳开课付款请选择方式打钩现金支票转帐
bad	尊敬的是工厂经理负责人你好我公司公司一家外资企业业务为多年进出口代理的公司
good	旁边一对早到的情侣来到时看到男的爬在女的身上正缠绵竟然在大众之下男的退掉女的裤子在那里疯狂的女生雪白的大腿露在外面
good	必将会成为世纪的主流商业模式健康产业孕育着前所未有的商机。能把握趋势的人
good	因进项较多现完成不了每月销售额度。每月有一部分增值税电脑发票左右和普通商品销售税发票国税地税广告运输服务左右优惠代开或合作
normal	投资有别在于与其他咨询机构的地方天富每次的有均操作仓位的建议
bad	五个球灵魂你的只有健康家庭朋友工作。这五个球做一个是是用橡胶的
